[
  {
    "id": "evidence.authentication.failed_ssh",
    "name": {
      "en": "Failed SSH authentication attempts",
      "pt": "Falhas de autenticação SSH",
      "de": "Fehlgeschlagene SSH-Authentifizierungsversuche"
    },
    "category": "authentication",
    "node_type": "authentication_event",
    "brief": {
      "en": "One or more failed authentication attempts using SSH.",
      "pt": "Uma ou mais tentativas malsucedidas de autenticação utilizando SSH.",
      "de": "Ein oder mehrere fehlgeschlagene Authentifizierungsversuche über SSH."
    },
    "fields": [
      {
        "id": "protocol",
        "label": { "en": "Protocol", "pt": "Protocolo", "de": "Protokoll" },
        "type": "string",
        "required": false
      },
      {
        "id": "result",
        "label": { "en": "Result", "pt": "Resultado", "de": "Ergebnis" },
        "type": "string",
        "required": false
      },
      {
        "id": "failed_attempts",
        "label": { "en": "Number of failures", "pt": "Quantidade de falhas", "de": "Anzahl der Fehlversuche" },
        "type": "number",
        "required": false
      },
      {
        "id": "source_ip",
        "label": { "en": "Source IP", "pt": "IP de origem", "de": "Quell-IP" },
        "type": "ip",
        "required": false
      },
      {
        "id": "target_users",
        "label": { "en": "Affected users", "pt": "Usuários afetados", "de": "Betroffene Benutzer" },
        "type": "string_array",
        "required": false
      },
      {
        "id": "timestamp",
        "label": { "en": "Date and time", "pt": "Data e hora", "de": "Datum und Uhrzeit" },
        "type": "datetime",
        "required": false
      }
    ],
    "educational_content": {
      "why_it_matters": {
        "en": "Many failures in a short period may indicate an automated attempt to discover credentials.",
        "pt": "Muitas falhas em curto período podem representar tentativa automatizada de descobrir credenciais.",
        "de": "Viele Fehlversuche in kurzer Zeit können auf einen automatisierten Versuch hindeuten, Anmeldedaten zu entdecken."
      },
      "suspicious_when": {
        "en": [
          "High volume in a short time",
          "Same IP attacking multiple users",
          "Attempts followed by a successful authentication"
        ],
        "pt": [
          "Grande volume em pouco tempo",
          "Mesmo IP atacando diversos usuários",
          "Tentativas seguidas por autenticação bem-sucedida"
        ],
        "de": [
          "Hohes Volumen in kurzer Zeit",
          "Gleiche IP greift mehrere Benutzer an",
          "Versuche gefolgt von erfolgreicher Authentifizierung"
        ]
      },
      "legitimate_when": {
        "en": ["Configuration error", "Service using an expired credential", "Authorized scanner"],
        "pt": ["Erro de configuração", "Serviço utilizando credencial expirada", "Scanner autorizado"],
        "de": ["Konfigurationsfehler", "Dienst verwendet abgelaufene Anmeldedaten", "Autorisierter Scanner"]
      }
    }
  },
  {
    "id": "evidence.authentication.successful_login",
    "name": {
      "en": "Successful authentication",
      "pt": "Autenticação bem-sucedida",
      "de": "Erfolgreiche Authentifizierung"
    },
    "category": "authentication",
    "node_type": "authentication_event",
    "brief": {
      "en": "An authentication event completed successfully.",
      "pt": "Um evento de autenticação concluído com sucesso.",
      "de": "Ein erfolgreich abgeschlossenes Authentifizierungsereignis."
    },
    "fields": [
      {
        "id": "protocol",
        "label": { "en": "Protocol", "pt": "Protocolo", "de": "Protokoll" },
        "type": "string",
        "required": false
      },
      {
        "id": "result",
        "label": { "en": "Result", "pt": "Resultado", "de": "Ergebnis" },
        "type": "string",
        "required": false
      },
      {
        "id": "source_ip",
        "label": { "en": "Source IP", "pt": "IP de origem", "de": "Quell-IP" },
        "type": "ip",
        "required": false
      },
      {
        "id": "target_users",
        "label": { "en": "Authenticated user", "pt": "Usuário autenticado", "de": "Authentifizierter Benutzer" },
        "type": "string_array",
        "required": false
      },
      {
        "id": "timestamp",
        "label": { "en": "Date and time", "pt": "Data e hora", "de": "Datum und Uhrzeit" },
        "type": "datetime",
        "required": false
      }
    ],
    "educational_content": {
      "why_it_matters": {
        "en": "A successful authentication right after several failures may indicate that a credential was discovered or compromised.",
        "pt": "Uma autenticação bem-sucedida logo após diversas falhas pode indicar que uma credencial foi descoberta ou comprometida.",
        "de": "Eine erfolgreiche Authentifizierung kurz nach mehreren Fehlversuchen kann darauf hindeuten, dass eine Anmeldedaten entdeckt oder kompromittiert wurde."
      },
      "suspicious_when": {
        "en": [
          "Occurs right after a sequence of failures",
          "Origin matches the IP of the failed attempts",
          "Login at an unusual time for the user"
        ],
        "pt": [
          "Ocorre logo após uma sequência de falhas",
          "Origem coincide com o IP das tentativas malsucedidas",
          "Login em horário incomum para o usuário"
        ],
        "de": [
          "Tritt unmittelbar nach einer Reihe von Fehlversuchen auf",
          "Herkunft stimmt mit der IP der Fehlversuche überein",
          "Anmeldung zu ungewöhnlicher Zeit für den Benutzer"
        ]
      },
      "legitimate_when": {
        "en": [
          "User remembered the correct password after typos",
          "Matches the user's normal access pattern"
        ],
        "pt": [
          "Usuário lembrou a senha correta após erros de digitação",
          "Corresponde ao padrão normal de acesso do usuário"
        ],
        "de": [
          "Benutzer erinnerte sich nach Tippfehlern an das richtige Passwort",
          "Entspricht dem normalen Zugriffsmuster des Benutzers"
        ]
      }
    }
  }
]
